{
  "name": "fmt",
  "type": "lib",
  "description": "A modern formatting library for C++",
  "license": "MIT",
  "homepage": "https://fmt.dev/",
  "repository": "https://github.com/dexoron/dcr-ports/packages/libs/f/fmt/",
  "keywords": ["formatting", "cpp", "printf", "iostream"],
  "categories": ["Systems", "Developer Tools"],
  "language": {
    "c": false,
    "cpp": true
  },
  "platforms": {
    "linux": true,
    "macos": true,
    "windows": true,
    "linux_arm": true,
    "macos_arm": true
  },
  "dcr": {
    "min_version": "0.5.0",
    "native": true,
    "notes": "Ported version that fetches original source during build"
  },
  "versions": [
    {
      "version": "10.2.1",
      "git": "https://github.com/dexoron/dcr-ports",
      "rev": "229ed6b60e594e198f56b1b2105bddd7a5364fae",
      "subpath": "packages/libs/f/fmt",
      "checksum": "sha256:1250e4cc58bf06ee631567523f48848dc4596133e163f02615c97f78bab6c811",
      "yanked": false,
      "published_at": "2026-05-12"
    }
  ],
  "author": {
    "name": "Dexoron",
    "github": "dexoron"
  }
}
